1	0.000000	10.40.160.10	10.40.160.14	TCP	60	2080 → 28083 [ACK] Seq=1 Ack=1 Win=8209 Len=1
2	0.000029	10.40.160.14	10.40.160.10	TCP	66	28083 → 2080 [ACK] Seq=1 Ack=2 Win=4096 Len=0 SLE=1 SRE=2
3	0.011736	10.40.160.14	10.40.160.10	TCP	55	[TCP Keep-Alive] 28083 → 2080 [ACK] Seq=0 Ack=2 Win=4096 Len=1
4	0.011789	SchneiderEle_e8:4e:f8	Broadcast	ARP	68	Who has 10.40.160.1? Tell 10.40.160.32
5	0.012434	10.40.160.10	10.40.160.14	TCP	66	[TCP Keep-Alive ACK] 2080 → 28083 [ACK] Seq=2 Ack=1 Win=8209 Len=0 SLE=0 SRE=1
6	0.092877	10.40.160.10	10.40.160.14	TCP	60	2085 → 28084 [ACK] Seq=1 Ack=1 Win=8210 Len=1
7	0.092916	10.40.160.14	10.40.160.10	TCP	66	28084 → 2085 [ACK] Seq=1 Ack=2 Win=507 Len=0 SLE=1 SRE=2
8	0.115726	Dell_98:32:ee	Broadcast	ARP	60	Who has 10.40.160.1? Tell 10.40.160.17
9	0.118891	10.40.160.10	10.40.160.14	TCP	107	2082 → 28081 [PSH, ACK] Seq=1 Ack=1 Win=8207 Len=53
10	0.119067	10.40.160.14	10.40.160.10	TCP	78	28081 → 2082 [PSH, ACK] Seq=1 Ack=54 Win=4100 Len=24
11	0.121645	10.40.160.14	10.40.160.10	TCP	55	[TCP Keep-Alive] 28084 → 2085 [ACK] Seq=0 Ack=2 Win=507 Len=1
12	0.122383	10.40.160.10	10.40.160.14	TCP	66	[TCP Keep-Alive ACK] 2085 → 28084 [ACK] Seq=2 Ack=1 Win=8210 Len=0 SLE=0 SRE=1
13	0.129755	10.40.160.10	10.40.160.14	TCP	60	2082 → 28081 [ACK] Seq=54 Ack=25 Win=8207 Len=0
14	0.164005	HMSIndustria_08:cb:12	Broadcast	ARP	60	Who has 10.40.160.1? Tell 10.40.160.140
15	0.202072	10.40.160.14	10.40.160.174	TLSv1.2	1022	Application Data
16	0.217264	10.40.160.10	10.40.160.14	TCP	60	2084 → 28082 [ACK] Seq=1 Ack=1 Win=8211 Len=1
17	0.217298	10.40.160.14	10.40.160.10	TCP	66	28082 → 2084 [ACK] Seq=1 Ack=2 Win=508 Len=0 SLE=1 SRE=2
18	0.247400	10.40.160.14	10.40.160.10	TCP	55	[TCP Keep-Alive] 28082 → 2084 [ACK] Seq=0 Ack=2 Win=508 Len=1
19	0.248091	10.40.160.10	10.40.160.14	TCP	66	[TCP Keep-Alive ACK] 2084 → 28082 [ACK] Seq=2 Ack=1 Win=8211 Len=0 SLE=0 SRE=1
20	0.278454	Dell_99:4f:87	Broadcast	ARP	60	Who has 10.40.160.1? Tell 10.40.160.18
21	0.291068	10.40.160.14	10.40.160.10	TCP	154	28081 → 2082 [PSH, ACK] Seq=25 Ack=54 Win=4100 Len=100
22	0.291180	10.40.160.14	10.40.160.10	TCP	154	28081 → 2082 [PSH, ACK] Seq=125 Ack=54 Win=4100 Len=100
23	0.291313	10.40.160.14	10.40.160.10	TCP	1498	28081 → 2082 [PSH, ACK] Seq=225 Ack=54 Win=4100 Len=1444
24	0.291483	10.40.160.14	10.40.160.10	TCP	1498	28081 → 2082 [PSH, ACK] Seq=1669 Ack=54 Win=4100 Len=1444
25	0.291555	10.40.160.14	10.40.160.10	TCP	1498	28081 → 2082 [PSH, ACK] Seq=3113 Ack=54 Win=4100 Len=1444
26	0.291591	10.40.160.10	10.40.160.14	TCP	60	2082 → 28081 [ACK] Seq=54 Ack=225 Win=8206 Len=0
27	0.291603	10.40.160.14	10.40.160.10	TCP	1498	28081 → 2082 [PSH, ACK] Seq=4557 Ack=54 Win=4100 Len=1444
28	0.291664	10.40.160.14	10.40.160.10	TCP	1498	28081 → 2082 [PSH, ACK] Seq=6001 Ack=54 Win=4100 Len=1444
29	0.291708	10.40.160.14	10.40.160.10	TCP	1498	28081 → 2082 [PSH, ACK] Seq=7445 Ack=54 Win=4100 Len=1444
30	0.291748	10.40.160.14	10.40.160.10	TCP	1498	28081 → 2082 [PSH, ACK] Seq=8889 Ack=54 Win=4100 Len=1444
31	0.291816	10.40.160.14	10.40.160.10	TCP	1498	28081 → 2082 [PSH, ACK] Seq=10333 Ack=54 Win=4100 Len=1444
32	0.291868	10.40.160.14	10.40.160.10	TCP	1162	28081 → 2082 [PSH, ACK] Seq=11777 Ack=54 Win=4100 Len=1108
33	0.292097	10.40.160.10	10.40.160.14	TCP	60	2082 → 28081 [ACK] Seq=54 Ack=3113 Win=8212 Len=0
34	0.292283	10.40.160.10	10.40.160.14	TCP	60	2082 → 28081 [ACK] Seq=54 Ack=6001 Win=8212 Len=0
35	0.292513	10.40.160.10	10.40.160.14	TCP	78	2082 → 28081 [PSH, ACK] Seq=54 Ack=6001 Win=8212 Len=24
36	0.292700	10.40.160.10	10.40.160.14	TCP	60	2082 → 28081 [ACK] Seq=78 Ack=8889 Win=8212 Len=0
37	0.293007	10.40.160.10	10.40.160.14	TCP	60	2082 → 28081 [ACK] Seq=78 Ack=11777 Win=8212 Len=0
38	0.293856	10.40.160.10	10.40.160.14	TCP	78	2082 → 28081 [PSH, ACK] Seq=78 Ack=12885 Win=8208 Len=24
39	0.293874	10.40.160.14	10.40.160.10	TCP	54	28081 → 2082 [ACK] Seq=12885 Ack=102 Win=4100 Len=0
40	0.294876	10.40.160.10	10.40.160.14	TCP	78	2082 → 28081 [PSH, ACK] Seq=102 Ack=12885 Win=8208 Len=24
41	0.296061	10.40.160.10	10.40.160.14	TCP	104	2082 → 28081 [PSH, ACK] Seq=126 Ack=12885 Win=8208 Len=50
42	0.296083	10.40.160.14	10.40.160.10	TCP	54	28081 → 2082 [ACK] Seq=12885 Ack=176 Win=4099 Len=0
43	0.296142	10.40.160.14	10.40.160.10	TCP	78	28081 → 2082 [PSH, ACK] Seq=12885 Ack=176 Win=4099 Len=24
44	0.297025	10.40.160.10	10.40.160.14	TCP	104	2082 → 28081 [PSH, ACK] Seq=176 Ack=12909 Win=8208 Len=50
45	0.297092	10.40.160.14	10.40.160.10	TCP	78	28081 → 2082 [PSH, ACK] Seq=12909 Ack=226 Win=4099 Len=24
46	0.297261	10.40.160.10	10.40.160.14	TCP	1498	2082 → 28081 [PSH, ACK] Seq=226 Ack=12909 Win=8208 Len=1444
47	0.297281	10.40.160.14	10.40.160.10	TCP	54	28081 → 2082 [ACK] Seq=12933 Ack=1670 Win=4100 Len=0
48	0.297343	10.40.160.14	10.40.160.10	TCP	78	28081 → 2082 [PSH, ACK] Seq=12933 Ack=1670 Win=4100 Len=24
49	0.297381	10.40.160.10	10.40.160.14	TCP	1498	2082 → 28081 [PSH, ACK] Seq=1670 Ack=12909 Win=8208 Len=1444
50	0.297453	10.40.160.14	10.40.160.10	TCP	78	28081 → 2082 [PSH, ACK] Seq=12957 Ack=3114 Win=4094 Len=24
51	0.297570	10.40.160.10	10.40.160.14	TCP	1498	2082 → 28081 [PSH, ACK] Seq=3114 Ack=12909 Win=8208 Len=1444
52	0.297570	10.40.160.10	10.40.160.14	TCP	852	2082 → 28081 [PSH, ACK] Seq=4558 Ack=12909 Win=8208 Len=798
53	0.297591	10.40.160.14	10.40.160.10	TCP	54	28081 → 2082 [ACK] Seq=12981 Ack=5356 Win=4100 Len=0
54	0.297664	10.40.160.14	10.40.160.10	TCP	78	28081 → 2082 [PSH, ACK] Seq=12981 Ack=5356 Win=4100 Len=24
55	0.297750	10.40.160.10	10.40.160.14	TCP	60	2082 → 28081 [ACK] Seq=5356 Ack=12957 Win=8207 Len=0
56	0.298028	10.40.160.14	10.40.160.10	TCP	90	28081 → 2082 [PSH, ACK] Seq=13005 Ack=5356 Win=4100 Len=36
57	0.298146	10.40.160.14	10.40.160.10	TCP	450	28081 → 2082 [PSH, ACK] Seq=13041 Ack=5356 Win=4100 Len=396
58	0.298179	10.40.160.10	10.40.160.14	TCP	60	2082 → 28081 [ACK] Seq=5356 Ack=13005 Win=8207 Len=0
59	0.298208	10.40.160.14	10.40.160.10	TCP	1510	28081 → 2082 [PSH, ACK] Seq=13437 Ack=5356 Win=4100 Len=1456
60	0.298237	10.40.160.14	10.40.160.10	TCP	1250	28081 → 2082 [PSH, ACK] Seq=14893 Ack=5356 Win=4100 Len=1196
61	0.298488	10.40.160.10	10.40.160.14	TCP	78	2082 → 28081 [PSH, ACK] Seq=5356 Ack=13041 Win=8207 Len=24
62	0.298488	10.40.160.10	10.40.160.14	TCP	60	2082 → 28081 [ACK] Seq=5380 Ack=13437 Win=8212 Len=0
63	0.298672	10.40.160.10	10.40.160.14	TCP	78	2082 → 28081 [PSH, ACK] Seq=5380 Ack=13437 Win=8212 Len=24
64	0.298685	10.40.160.14	10.40.160.10	TCP	54	28081 → 2082 [ACK] Seq=16089 Ack=5404 Win=4100 Len=0
65	0.298918	10.40.160.10	10.40.160.14	TCP	78	2082 → 28081 [PSH, ACK] Seq=5404 Ack=14893 Win=8206 Len=24
66	0.299104	10.40.160.10	10.40.160.14	TCP	60	2082 → 28081 [ACK] Seq=5428 Ack=16089 Win=8212 Len=0
67	0.299314	10.40.160.10	10.40.160.14	TCP	78	2082 → 28081 [PSH, ACK] Seq=5428 Ack=16089 Win=8212 Len=24
68	0.299329	10.40.160.14	10.40.160.10	TCP	54	28081 → 2082 [ACK] Seq=16089 Ack=5452 Win=4100 Len=0
69	0.302678	10.40.160.174	10.40.160.14	TLSv1.2	551	Application Data
70	0.302902	10.40.160.174	10.40.160.14	TLSv1.2	463	Application Data
71	0.302925	10.40.160.14	10.40.160.174	TCP	54	47824 → 443 [ACK] Seq=969 Ack=907 Win=509 Len=0
72	0.542898	AbbAbbSaceDi_10:ca:93	Broadcast	ARP	60	ARP Announcement for 10.40.160.107
73	0.696974	10.40.160.14	224.0.0.251	MDNS	74	Standard query 0x0000 A db-mongo.local, "QM" question
74	0.697382	fe80::3d2c:2b50:8f94:bc16	ff02::fb	MDNS	94	Standard query 0x0000 A db-mongo.local, "QM" question
75	0.697793	10.40.160.14	224.0.0.251	MDNS	74	Standard query 0x0000 AAAA db-mongo.local, "QM" question
76	0.698103	fe80::3d2c:2b50:8f94:bc16	ff02::fb	MDNS	94	Standard query 0x0000 AAAA db-mongo.local, "QM" question
77	0.904646	Dell_98:32:ee	Broadcast	ARP	60	Who has 10.40.160.1? Tell 10.40.160.17
78	0.994748	AbbAbbSaceDi_10:9e:ae	Broadcast	ARP	60	ARP Announcement for 10.40.160.105
79	1.000457	10.40.160.10	10.40.160.14	TCP	60	[TCP Keep-Alive] 2080 → 28083 [ACK] Seq=1 Ack=1 Win=8209 Len=1
80	1.000495	10.40.160.14	10.40.160.10	TCP	66	[TCP Keep-Alive ACK] 28083 → 2080 [ACK] Seq=1 Ack=2 Win=4096 Len=0 SLE=1 SRE=2
81	1.024295	10.40.160.14	10.40.160.10	TCP	55	[TCP Keep-Alive] 28083 → 2080 [ACK] Seq=0 Ack=2 Win=4096 Len=1
82	1.025003	10.40.160.10	10.40.160.14	TCP	66	[TCP Keep-Alive ACK] 2080 → 28083 [ACK] Seq=2 Ack=1 Win=8209 Len=0 SLE=0 SRE=1
83	1.094201	10.40.160.10	10.40.160.14	TCP	60	[TCP Keep-Alive] 2085 → 28084 [ACK] Seq=1 Ack=1 Win=8210 Len=1
84	1.094230	10.40.160.14	10.40.160.10	TCP	66	[TCP Keep-Alive ACK] 28084 → 2085 [ACK] Seq=1 Ack=2 Win=507 Len=0 SLE=1 SRE=2
85	1.117069	10.40.160.10	10.40.160.14	TCP	107	2082 → 28081 [PSH, ACK] Seq=5452 Ack=16089 Win=8212 Len=53
86	1.117228	10.40.160.14	10.40.160.10	TCP	78	28081 → 2082 [PSH, ACK] Seq=16089 Ack=5505 Win=4099 Len=24
87	1.128103	10.40.160.10	10.40.160.14	TCP	60	2082 → 28081 [ACK] Seq=5505 Ack=16113 Win=8212 Len=0
88	1.132473	10.40.160.14	10.40.160.10	TCP	55	[TCP Keep-Alive] 28084 → 2085 [ACK] Seq=0 Ack=2 Win=507 Len=1
89	1.133320	10.40.160.10	10.40.160.14	TCP	66	[TCP Keep-Alive ACK] 2085 → 28084 [ACK] Seq=2 Ack=1 Win=8210 Len=0 SLE=0 SRE=1
90	1.135571	10.40.160.10	10.40.160.14	TCP	99	2080 → 28083 [PSH, ACK] Seq=2 Ack=1 Win=8209 Len=45
91	1.135723	10.40.160.14	10.40.160.10	TCP	78	28083 → 2080 [PSH, ACK] Seq=1 Ack=47 Win=4096 Len=24
92	1.136725	10.40.160.10	10.40.160.14	TCP	1514	2080 → 28083 [ACK] Seq=47 Ack=25 Win=8209 Len=1460
93	1.156186	10.40.160.10	10.40.160.14	TCP	1514	[TCP Retransmission] 2080 → 28083 [ACK] Seq=47 Ack=25 Win=8209 Len=1460
94	1.156236	10.40.160.14	10.40.160.10	TCP	66	28083 → 2080 [ACK] Seq=25 Ack=1507 Win=4100 Len=0 SLE=47 SRE=1507
95	1.157014	10.40.160.10	10.40.160.14	TCP	1097	2080 → 28083 [PSH, ACK] Seq=1507 Ack=25 Win=8209 Len=1043
96	1.157067	10.40.160.14	10.40.160.10	TCP	54	28083 → 2080 [ACK] Seq=25 Ack=2550 Win=4096 Len=0
97	1.157355	10.40.160.14	10.40.160.10	TCP	78	28083 → 2080 [PSH, ACK] Seq=25 Ack=2550 Win=4096 Len=24
98	1.159732	HMSIndustria_08:cb:12	Broadcast	ARP	60	Who has 10.40.160.1? Tell 10.40.160.140
99	1.167996	10.40.160.10	10.40.160.14	TCP	60	2080 → 28083 [ACK] Seq=2550 Ack=49 Win=8209 Len=0
100	1.202591	10.40.160.10	10.40.160.14	TCP	1514	2082 → 28081 [ACK] Seq=5505 Ack=16113 Win=8212 Len=1460
101	1.202680	10.40.160.10	10.40.160.14	TCP	1514	2082 → 28081 [ACK] Seq=6965 Ack=16113 Win=8212 Len=1460
102	1.202701	10.40.160.14	10.40.160.10	TCP	54	28081 → 2082 [ACK] Seq=16113 Ack=8425 Win=4100 Len=0
103	1.202872	10.40.160.10	10.40.160.14	TCP	1514	2082 → 28081 [ACK] Seq=8425 Ack=16113 Win=8212 Len=1460
104	1.202872	10.40.160.10	10.40.160.14	TCP	325	2082 → 28081 [PSH, ACK] Seq=9885 Ack=16113 Win=8212 Len=271
105	1.202906	10.40.160.14	10.40.160.10	TCP	54	28081 → 2082 [ACK] Seq=16113 Ack=10156 Win=4100 Len=0
106	1.202940	10.40.160.10	10.40.160.14	TCP	1514	2082 → 28081 [ACK] Seq=10156 Ack=16113 Win=8212 Len=1460
107	1.203039	10.40.160.14	10.40.160.10	TCP	78	28081 → 2082 [PSH, ACK] Seq=16113 Ack=11616 Win=4100 Len=24
108	1.203068	10.40.160.10	10.40.160.14	TCP	1514	2082 → 28081 [ACK] Seq=11616 Ack=16113 Win=8212 Len=1460
109	1.203085	10.40.160.14	10.40.160.10	TCP	54	28081 → 2082 [ACK] Seq=16137 Ack=13076 Win=4100 Len=0
110	1.203185	10.40.160.10	10.40.160.14	TCP	1514	2082 → 28081 [ACK] Seq=13076 Ack=16113 Win=8212 Len=1460
111	1.203199	10.40.160.14	10.40.160.10	TCP	54	28081 → 2082 [ACK] Seq=16137 Ack=14536 Win=4100 Len=0
112	1.203220	10.40.160.10	10.40.160.14	TCP	325	2082 → 28081 [PSH, ACK] Seq=14536 Ack=16113 Win=8212 Len=271
113	1.203290	10.40.160.14	10.40.160.10	TCP	78	28081 → 2082 [PSH, ACK] Seq=16137 Ack=14807 Win=4099 Len=24
114	1.203335	10.40.160.10	10.40.160.14	TCP	1514	2082 → 28081 [ACK] Seq=14807 Ack=16113 Win=8212 Len=1460
115	1.203352	10.40.160.14	10.40.160.10	TCP	54	28081 → 2082 [ACK] Seq=16161 Ack=16267 Win=4100 Len=0
116	1.203458	10.40.160.10	10.40.160.14	TCP	1514	2082 → 28081 [ACK] Seq=16267 Ack=16113 Win=8212 Len=1460
117	1.203472	10.40.160.14	10.40.160.10	TCP	54	28081 → 2082 [ACK] Seq=16161 Ack=17727 Win=4100 Len=0
118	1.203652	10.40.160.10	10.40.160.14	TCP	1514	2082 → 28081 [ACK] Seq=17727 Ack=16113 Win=8212 Len=1460
119	1.203652	10.40.160.10	10.40.160.14	TCP	325	2082 → 28081 [PSH, ACK] Seq=19187 Ack=16113 Win=8212 Len=271
120	1.203673	10.40.160.14	10.40.160.10	TCP	54	28081 → 2082 [ACK] Seq=16161 Ack=19458 Win=4100 Len=0
121	1.203736	10.40.160.14	10.40.160.10	TCP	78	28081 → 2082 [PSH, ACK] Seq=16161 Ack=19458 Win=4100 Len=24
122	1.203847	10.40.160.10	10.40.160.14	TCP	1514	2082 → 28081 [ACK] Seq=19458 Ack=16113 Win=8212 Len=1460
123	1.203847	10.40.160.10	10.40.160.14	TCP	1514	2082 → 28081 [ACK] Seq=20918 Ack=16113 Win=8212 Len=1460
124	1.203866	10.40.160.14	10.40.160.10	TCP	54	28081 → 2082 [ACK] Seq=16185 Ack=22378 Win=4100 Len=0
125	1.204102	10.40.160.10	10.40.160.14	TCP	1514	2082 → 28081 [ACK] Seq=22378 Ack=16113 Win=8212 Len=1460
126	1.204102	10.40.160.10	10.40.160.14	TCP	325	2082 → 28081 [PSH, ACK] Seq=23838 Ack=16113 Win=8212 Len=271
127	1.204119	10.40.160.14	10.40.160.10	TCP	54	28081 → 2082 [ACK] Seq=16185 Ack=24109 Win=4100 Len=0
128	1.204172	10.40.160.14	10.40.160.10	TCP	78	28081 → 2082 [PSH, ACK] Seq=16185 Ack=24109 Win=4100 Len=24
129	1.204285	10.40.160.10	10.40.160.14	TCP	1514	2082 → 28081 [ACK] Seq=24109 Ack=16137 Win=8212 Len=1460
130	1.204285	10.40.160.10	10.40.160.14	TCP	1514	2082 → 28081 [ACK] Seq=25569 Ack=16137 Win=8212 Len=1460
131	1.204308	10.40.160.14	10.40.160.10	TCP	54	28081 → 2082 [ACK] Seq=16209 Ack=27029 Win=4100 Len=0
132	1.204376	10.40.160.10	10.40.160.14	TCP	1514	2082 → 28081 [ACK] Seq=27029 Ack=16137 Win=8212 Len=1460
133	1.204388	10.40.160.14	10.40.160.10	TCP	54	28081 → 2082 [ACK] Seq=16209 Ack=28489 Win=4100 Len=0
134	1.204410	10.40.160.10	10.40.160.14	TCP	325	2082 → 28081 [PSH, ACK] Seq=28489 Ack=16137 Win=8212 Len=271
135	1.204423	10.40.160.14	10.40.160.10	TCP	54	28081 → 2082 [ACK] Seq=16209 Ack=28760 Win=4099 Len=0
136	1.204476	10.40.160.14	10.40.160.10	TCP	78	28081 → 2082 [PSH, ACK] Seq=16209 Ack=28760 Win=4099 Len=24
137	1.204524	10.40.160.10	10.40.160.14	TCP	1514	2082 → 28081 [ACK] Seq=28760 Ack=16161 Win=8212 Len=1460
138	1.204537	10.40.160.14	10.40.160.10	TCP	54	28081 → 2082 [ACK] Seq=16233 Ack=30220 Win=4100 Len=0
139	1.204793	10.40.160.10	10.40.160.14	TCP	1514	2082 → 28081 [ACK] Seq=30220 Ack=16161 Win=8212 Len=1460
140	1.204793	10.40.160.10	10.40.160.14	TCP	1514	2082 → 28081 [ACK] Seq=31680 Ack=16161 Win=8212 Len=1460
141	1.204793	10.40.160.10	10.40.160.14	TCP	325	2082 → 28081 [PSH, ACK] Seq=33140 Ack=16161 Win=8212 Len=271
142	1.204819	10.40.160.14	10.40.160.10	TCP	54	28081 → 2082 [ACK] Seq=16233 Ack=33411 Win=4100 Len=0
143	1.204864	10.40.160.14	10.40.160.10	TCP	78	28081 → 2082 [PSH, ACK] Seq=16233 Ack=33411 Win=4100 Len=24
144	1.205036	10.40.160.10	10.40.160.14	TCP	1514	2082 → 28081 [ACK] Seq=33411 Ack=16161 Win=8212 Len=1460
145	1.205036	10.40.160.10	10.40.160.14	TCP	1514	2082 → 28081 [ACK] Seq=34871 Ack=16161 Win=8212 Len=1460
146	1.205069	10.40.160.14	10.40.160.10	TCP	54	28081 → 2082 [ACK] Seq=16257 Ack=36331 Win=4100 Len=0
147	1.205306	10.40.160.10	10.40.160.14	TCP	1514	2082 → 28081 [ACK] Seq=36331 Ack=16161 Win=8212 Len=1460
148	1.205306	10.40.160.10	10.40.160.14	TCP	325	2082 → 28081 [PSH, ACK] Seq=37791 Ack=16161 Win=8212 Len=271
149	1.205306	10.40.160.10	10.40.160.14	TCP	60	2082 → 28081 [ACK] Seq=38062 Ack=16209 Win=8212 Len=0
150	1.205306	10.40.160.10	10.40.160.14	TCP	60	2082 → 28081 [ACK] Seq=38062 Ack=16257 Win=8211 Len=0
151	1.205329	10.40.160.14	10.40.160.10	TCP	54	28081 → 2082 [ACK] Seq=16257 Ack=38062 Win=4100 Len=0
152	1.205378	10.40.160.14	10.40.160.10	TCP	78	28081 → 2082 [PSH, ACK] Seq=16257 Ack=38062 Win=4100 Len=24
153	1.207263	10.40.160.10	10.40.160.14	TCP	1514	2082 → 28081 [ACK] Seq=38062 Ack=16281 Win=8211 Len=1460
154	1.207263	10.40.160.10	10.40.160.14	TCP	1514	2082 → 28081 [ACK] Seq=39522 Ack=16281 Win=8211 Len=1460
155	1.207286	10.40.160.14	10.40.160.10	TCP	54	28081 → 2082 [ACK] Seq=16281 Ack=40982 Win=4100 Len=0
156	1.207469	10.40.160.10	10.40.160.14	TCP	1514	2082 → 28081 [ACK] Seq=40982 Ack=16281 Win=8211 Len=1460
157	1.207469	10.40.160.10	10.40.160.14	TCP	325	2082 → 28081 [PSH, ACK] Seq=42442 Ack=16281 Win=8211 Len=271
158	1.207488	10.40.160.14	10.40.160.10	TCP	54	28081 → 2082 [ACK] Seq=16281 Ack=42713 Win=4100 Len=0
159	1.207530	10.40.160.10	10.40.160.14	TCP	1514	2082 → 28081 [ACK] Seq=42713 Ack=16281 Win=8211 Len=1460
160	1.207610	10.40.160.14	10.40.160.10	TCP	78	28081 → 2082 [PSH, ACK] Seq=16281 Ack=44173 Win=4100 Len=24
161	1.207745	10.40.160.10	10.40.160.14	TCP	1514	2082 → 28081 [ACK] Seq=44173 Ack=16281 Win=8211 Len=1460
162	1.207760	10.40.160.14	10.40.160.10	TCP	54	28081 → 2082 [ACK] Seq=16305 Ack=45633 Win=4100 Len=0
163	1.207780	10.40.160.10	10.40.160.14	TCP	1514	2082 → 28081 [ACK] Seq=45633 Ack=16281 Win=8211 Len=1460
164	1.207801	10.40.160.14	10.40.160.10	TCP	54	28081 → 2082 [ACK] Seq=16305 Ack=47093 Win=4100 Len=0
165	1.207825	10.40.160.10	10.40.160.14	TCP	325	2082 → 28081 [PSH, ACK] Seq=47093 Ack=16281 Win=8211 Len=271
166	1.207910	10.40.160.14	10.40.160.10	TCP	78	28081 → 2082 [PSH, ACK] Seq=16305 Ack=47364 Win=4099 Len=24
167	1.208083	10.40.160.10	10.40.160.14	TCP	1514	2082 → 28081 [ACK] Seq=47364 Ack=16281 Win=8211 Len=1460
168	1.208083	10.40.160.10	10.40.160.14	TCP	437	2082 → 28081 [PSH, ACK] Seq=48824 Ack=16281 Win=8211 Len=383
169	1.208110	10.40.160.14	10.40.160.10	TCP	54	28081 → 2082 [ACK] Seq=16329 Ack=49207 Win=4100 Len=0
170	1.208171	10.40.160.14	10.40.160.10	TCP	78	28081 → 2082 [PSH, ACK] Seq=16329 Ack=49207 Win=4100 Len=24
171	1.208644	10.40.160.10	10.40.160.14	TCP	60	2082 → 28081 [ACK] Seq=49207 Ack=16329 Win=8211 Len=0
172	1.217829	10.40.160.10	10.40.160.14	TCP	60	[TCP Keep-Alive] 2084 → 28082 [ACK] Seq=1 Ack=1 Win=8211 Len=1
173	1.217852	10.40.160.14	10.40.160.10	TCP	66	[TCP Keep-Alive ACK] 28082 → 2084 [ACK] Seq=1 Ack=2 Win=508 Len=0 SLE=1 SRE=2
174	1.218817	10.40.160.10	10.40.160.14	TCP	60	2082 → 28081 [ACK] Seq=49207 Ack=16353 Win=8211 Len=0
175	1.255994	10.40.160.14	10.40.160.10	TCP	55	[TCP Keep-Alive] 28082 → 2084 [ACK] Seq=0 Ack=2 Win=508 Len=1
176	1.256739	10.40.160.10	10.40.160.14	TCP	66	[TCP Keep-Alive ACK] 2084 → 28082 [ACK] Seq=2 Ack=1 Win=8211 Len=0 SLE=0 SRE=1
177	1.290214	10.40.160.14	10.40.160.10	TCP	154	28081 → 2082 [PSH, ACK] Seq=16353 Ack=49207 Win=4100 Len=100
178	1.290488	10.40.160.14	10.40.160.10	TCP	1498	28081 → 2082 [PSH, ACK] Seq=16453 Ack=49207 Win=4100 Len=1444
179	1.290661	10.40.160.14	10.40.160.10	TCP	1498	28081 → 2082 [PSH, ACK] Seq=17897 Ack=49207 Win=4100 Len=1444
180	1.290709	10.40.160.14	10.40.160.10	TCP	1498	28081 → 2082 [PSH, ACK] Seq=19341 Ack=49207 Win=4100 Len=1444
181	1.290770	10.40.160.14	10.40.160.10	TCP	1498	28081 → 2082 [PSH, ACK] Seq=20785 Ack=49207 Win=4100 Len=1444
182	1.290814	10.40.160.14	10.40.160.10	TCP	1498	28081 → 2082 [PSH, ACK] Seq=22229 Ack=49207 Win=4100 Len=1444
183	1.290876	10.40.160.14	10.40.160.10	TCP	1498	28081 → 2082 [PSH, ACK] Seq=23673 Ack=49207 Win=4100 Len=1444
184	1.290892	10.40.160.10	10.40.160.14	TCP	78	2082 → 28081 [PSH, ACK] Seq=49207 Ack=16453 Win=8211 Len=24
185	1.290943	10.40.160.14	10.40.160.10	TCP	1498	28081 → 2082 [PSH, ACK] Seq=25117 Ack=49231 Win=4100 Len=1444
186	1.290991	10.40.160.14	10.40.160.10	TCP	1498	28081 → 2082 [PSH, ACK] Seq=26561 Ack=49231 Win=4100 Len=1444
187	1.291047	10.40.160.14	10.40.160.10	TCP	1246	28081 → 2082 [PSH, ACK] Seq=28005 Ack=49231 Win=4100 Len=1192
188	1.291315	10.40.160.10	10.40.160.14	TCP	60	2082 → 28081 [ACK] Seq=49231 Ack=17897 Win=8212 Len=0
189	1.291315	10.40.160.10	10.40.160.14	TCP	60	2082 → 28081 [ACK] Seq=49231 Ack=19341 Win=8206 Len=0
190	1.291315	10.40.160.10	10.40.160.14	TCP	78	2082 → 28081 [PSH, ACK] Seq=49231 Ack=19341 Win=8206 Len=24
191	1.291356	10.40.160.10	10.40.160.14	TCP	60	2082 → 28081 [ACK] Seq=49255 Ack=20785 Win=8212 Len=0
192	1.291579	10.40.160.10	10.40.160.14	TCP	60	2082 → 28081 [ACK] Seq=49255 Ack=22229 Win=8206 Len=0
193	1.291579	10.40.160.10	10.40.160.14	TCP	104	2082 → 28081 [PSH, ACK] Seq=49255 Ack=22229 Win=8206 Len=50
194	1.291598	10.40.160.14	10.40.160.10	TCP	54	28081 → 2082 [ACK] Seq=29197 Ack=49305 Win=4100 Len=0
195	1.291633	10.40.160.14	10.40.160.10	TCP	78	28081 → 2082 [PSH, ACK] Seq=29197 Ack=49305 Win=4100 Len=24
196	1.291681	10.40.160.10	10.40.160.14	TCP	60	2082 → 28081 [ACK] Seq=49305 Ack=23673 Win=8212 Len=0
197	1.291681	10.40.160.10	10.40.160.14	TCP	78	2082 → 28081 [PSH, ACK] Seq=49305 Ack=23673 Win=8212 Len=24
198	1.292106	10.40.160.10	10.40.160.14	TCP	60	2082 → 28081 [ACK] Seq=49329 Ack=26561 Win=8212 Len=0
199	1.292106	10.40.160.10	10.40.160.14	TCP	78	2082 → 28081 [PSH, ACK] Seq=49329 Ack=26561 Win=8212 Len=24
200	1.292106	10.40.160.10	10.40.160.14	TCP	60	2082 → 28081 [ACK] Seq=49353 Ack=29221 Win=8212 Len=0
201	1.292124	10.40.160.14	10.40.160.10	TCP	54	28081 → 2082 [ACK] Seq=29221 Ack=49353 Win=4099 Len=0
202	1.292350	10.40.160.10	10.40.160.14	TCP	588	2082 → 28081 [PSH, ACK] Seq=49353 Ack=29221 Win=8212 Len=534
203	1.292425	10.40.160.14	10.40.160.10	TCP	78	28081 → 2082 [PSH, ACK] Seq=29221 Ack=49887 Win=4097 Len=24
204	1.292677	10.40.160.10	10.40.160.14	TCP	724	2082 → 28081 [PSH, ACK] Seq=49887 Ack=29221 Win=8212 Len=670
205	1.292740	10.40.160.14	10.40.160.10	TCP	78	28081 → 2082 [PSH, ACK] Seq=29245 Ack=50557 Win=4095 Len=24
206	1.292868	10.40.160.10	10.40.160.14	TCP	1098	2082 → 28081 [PSH, ACK] Seq=50557 Ack=29221 Win=8212 Len=1044
207	1.292880	10.40.160.14	10.40.160.10	TCP	54	28081 → 2082 [ACK] Seq=29269 Ack=51601 Win=4100 Len=0
208	1.292922	10.40.160.14	10.40.160.10	TCP	78	28081 → 2082 [PSH, ACK] Seq=29269 Ack=51601 Win=4100 Len=24
209	1.293194	10.40.160.10	10.40.160.14	TCP	1362	2082 → 28081 [PSH, ACK] Seq=51601 Ack=29221 Win=8212 Len=1308
210	1.293194	10.40.160.10	10.40.160.14	TCP	750	2082 → 28081 [PSH, ACK] Seq=52909 Ack=29221 Win=8212 Len=696
211	1.293194	10.40.160.10	10.40.160.14	TCP	988	2082 → 28081 [PSH, ACK] Seq=53605 Ack=29221 Win=8212 Len=934
212	1.293194	10.40.160.10	10.40.160.14	TCP	104	2082 → 28081 [PSH, ACK] Seq=54539 Ack=29221 Win=8212 Len=50
213	1.293194	10.40.160.10	10.40.160.14	TCP	60	2082 → 28081 [ACK] Seq=54589 Ack=29269 Win=8212 Len=0
214	1.293223	10.40.160.14	10.40.160.10	TCP	54	28081 → 2082 [ACK] Seq=29293 Ack=54589 Win=4100 Len=0
215	1.293291	10.40.160.14	10.40.160.10	TCP	78	28081 → 2082 [PSH, ACK] Seq=29293 Ack=54589 Win=4100 Len=24
216	1.293903	10.40.160.10	10.40.160.14	TCP	60	2082 → 28081 [ACK] Seq=54589 Ack=29317 Win=8212 Len=0
217	1.325926	Dell_16:33:d3	Broadcast	ARP	60	Who has 10.40.160.1? Tell 10.40.160.15
218	1.341252	Cisco_97:0f:8a	Spanning-tree-(for-bridges)_00	STP	60	RST. Root = 32768/60/34:1b:2d:95:26:00  Cost = 4  Port = 0x800a
219	1.491886	Dell_99:4f:87	Broadcast	ARP	60	Who has 10.40.160.1? Tell 10.40.160.18
220	1.536638	AbbAbbSaceDi_10:9e:92	Broadcast	ARP	60	ARP Announcement for 10.40.160.104
221	1.537838	10.40.160.14	10.40.160.174	TLSv1.2	949	Application Data
222	1.544440	10.40.160.174	10.40.160.14	TLSv1.2	551	Application Data
223	1.544659	10.40.160.174	10.40.160.14	TLSv1.2	269	Application Data
224	1.544680	10.40.160.14	10.40.160.174	TCP	54	47824 → 443 [ACK] Seq=1864 Ack=1619 Win=513 Len=0
225	1.553625	10.40.160.14	10.40.160.174	TLSv1.2	960	Application Data
226	1.553820	10.40.160.14	10.40.160.174	TLSv1.2	1024	Application Data
227	1.561860	10.40.160.174	10.40.160.14	TLSv1.2	551	Application Data
228	1.562148	10.40.160.174	10.40.160.14	TLSv1.2	267	Application Data
229	1.562167	10.40.160.14	10.40.160.174	TCP	54	47824 → 443 [ACK] Seq=2770 Ack=2329 Win=510 Len=0
230	1.594924	10.40.160.10	10.40.160.14	TCP	104	2082 → 28081 [PSH, ACK] Seq=54589 Ack=29317 Win=8212 Len=50
231	1.595073	10.40.160.14	10.40.160.10	TCP	78	28081 → 2082 [PSH, ACK] Seq=29317 Ack=54639 Win=4100 Len=24
232	1.595433	10.40.160.14	10.40.160.10	TCP	90	28081 → 2082 [PSH, ACK] Seq=29341 Ack=54639 Win=4100 Len=36
233	1.595588	10.40.160.14	10.40.160.10	TCP	830	28081 → 2082 [PSH, ACK] Seq=29377 Ack=54639 Win=4100 Len=776
234	1.595648	10.40.160.14	10.40.160.10	TCP	1510	28081 → 2082 [PSH, ACK] Seq=30153 Ack=54639 Win=4100 Len=1456
235	1.595707	10.40.160.14	10.40.160.10	TCP	870	28081 → 2082 [PSH, ACK] Seq=31609 Ack=54639 Win=4100 Len=816
236	1.596139	10.40.160.10	10.40.160.14	TCP	60	2082 → 28081 [ACK] Seq=54639 Ack=29377 Win=8211 Len=0
237	1.596139	10.40.160.10	10.40.160.14	TCP	78	2082 → 28081 [PSH, ACK] Seq=54639 Ack=29377 Win=8211 Len=24
238	1.596139	10.40.160.10	10.40.160.14	TCP	78	2082 → 28081 [PSH, ACK] Seq=54663 Ack=30153 Win=8208 Len=24
239	1.596169	10.40.160.14	10.40.160.10	TCP	54	28081 → 2082 [ACK] Seq=32425 Ack=54687 Win=4100 Len=0
240	1.596349	10.40.160.10	10.40.160.14	TCP	60	2082 → 28081 [ACK] Seq=54687 Ack=31609 Win=8212 Len=0
241	1.596349	10.40.160.10	10.40.160.14	TCP	78	2082 → 28081 [PSH, ACK] Seq=54687 Ack=31609 Win=8212 Len=24
242	1.596825	10.40.160.10	10.40.160.14	TCP	78	2082 → 28081 [PSH, ACK] Seq=54711 Ack=32425 Win=8209 Len=24
243	1.596840	10.40.160.14	10.40.160.10	TCP	54	28081 → 2082 [ACK] Seq=32425 Ack=54735 Win=4099 Len=0
244	1.702392	10.40.160.174	10.40.160.14	TLSv1.2	551	Application Data
245	1.702649	10.40.160.174	10.40.160.14	TLSv1.2	592	Application Data
246	1.702679	10.40.160.14	10.40.160.174	TCP	54	47825 → 443 [ACK] Seq=971 Ack=1036 Win=509 Len=0
247	1.706750	10.40.160.14	10.40.160.174	TLSv1.2	1022	Application Data
248	1.724013	10.40.160.10	10.40.160.14	TCP	1514	2082 → 28081 [ACK] Seq=54735 Ack=32425 Win=8209 Len=1460
249	1.724232	10.40.160.10	10.40.160.14	TCP	1514	2082 → 28081 [ACK] Seq=56195 Ack=32425 Win=8209 Len=1460
250	1.724232	10.40.160.10	10.40.160.14	TCP	1514	2082 → 28081 [ACK] Seq=57655 Ack=32425 Win=8209 Len=1460
251	1.724232	10.40.160.10	10.40.160.14	TCP	325	2082 → 28081 [PSH, ACK] Seq=59115 Ack=32425 Win=8209 Len=271
252	1.724269	10.40.160.14	10.40.160.10	TCP	54	28081 → 2082 [ACK] Seq=32425 Ack=59386 Win=4100 Len=0
253	1.724391	10.40.160.14	10.40.160.10	TCP	78	28081 → 2082 [PSH, ACK] Seq=32425 Ack=59386 Win=4100 Len=24
254	1.724702	10.40.160.10	10.40.160.14	TCP	1514	2082 → 28081 [ACK] Seq=59386 Ack=32425 Win=8209 Len=1460
255	1.724702	10.40.160.10	10.40.160.14	TCP	1514	2082 → 28081 [ACK] Seq=60846 Ack=32425 Win=8209 Len=1460
256	1.724732	10.40.160.14	10.40.160.10	TCP	54	28081 → 2082 [ACK] Seq=32449 Ack=62306 Win=4100 Len=0
257	1.724892	10.40.160.10	10.40.160.14	TCP	1514	2082 → 28081 [ACK] Seq=62306 Ack=32425 Win=8209 Len=1460
258	1.724892	10.40.160.10	10.40.160.14	TCP	325	2082 → 28081 [PSH, ACK] Seq=63766 Ack=32425 Win=8209 Len=271
259	1.724916	10.40.160.14	10.40.160.10	TCP	54	28081 → 2082 [ACK] Seq=32449 Ack=64037 Win=4100 Len=0
260	1.724992	10.40.160.14	10.40.160.10	TCP	78	28081 → 2082 [PSH, ACK] Seq=32449 Ack=64037 Win=4100 Len=24
261	1.725690	10.40.160.10	10.40.160.14	TCP	60	2082 → 28081 [ACK] Seq=64037 Ack=32473 Win=8209 Len=0
262	1.727977	10.40.160.10	10.40.160.14	TCP	1514	2082 → 28081 [ACK] Seq=64037 Ack=32473 Win=8209 Len=1460
263	1.728238	10.40.160.10	10.40.160.14	TCP	1514	2082 → 28081 [ACK] Seq=65497 Ack=32473 Win=8209 Len=1460
264	1.728238	10.40.160.10	10.40.160.14	TCP	1514	2082 → 28081 [ACK] Seq=66957 Ack=32473 Win=8209 Len=1460
265	1.728238	10.40.160.10	10.40.160.14	TCP	325	2082 → 28081 [PSH, ACK] Seq=68417 Ack=32473 Win=8209 Len=271
266	1.728270	10.40.160.14	10.40.160.10	TCP	54	28081 → 2082 [ACK] Seq=32473 Ack=68688 Win=4100 Len=0
267	1.728288	10.40.160.174	10.40.160.14	TLSv1.2	551	Application Data
268	1.728337	10.40.160.14	10.40.160.10	TCP	78	28081 → 2082 [PSH, ACK] Seq=32473 Ack=68688 Win=4100 Len=24
269	1.728354	10.40.160.174	10.40.160.14	TLSv1.2	463	Application Data
270	1.728376	10.40.160.14	10.40.160.174	TCP	54	47825 → 443 [ACK] Seq=1939 Ack=1942 Win=513 Len=0
271	1.728452	10.40.160.10	10.40.160.14	TCP	1514	2082 → 28081 [ACK] Seq=68688 Ack=32473 Win=8209 Len=1460
272	1.728475	10.40.160.14	10.40.160.10	TCP	54	28081 → 2082 [ACK] Seq=32497 Ack=70148 Win=4100 Len=0
273	1.728578	10.40.160.10	10.40.160.14	TCP	1514	2082 → 28081 [ACK] Seq=70148 Ack=32473 Win=8209 Len=1460
274	1.728607	10.40.160.14	10.40.160.10	TCP	54	28081 → 2082 [ACK] Seq=32497 Ack=71608 Win=4100 Len=0
275	1.728698	10.40.160.10	10.40.160.14	TCP	1514	2082 → 28081 [ACK] Seq=71608 Ack=32473 Win=8209 Len=1460
276	1.728722	10.40.160.14	10.40.160.10	TCP	54	28081 → 2082 [ACK] Seq=32497 Ack=73068 Win=4100 Len=0
277	1.728751	10.40.160.10	10.40.160.14	TCP	325	2082 → 28081 [PSH, ACK] Seq=73068 Ack=32473 Win=8209 Len=271
278	1.728775	10.40.160.14	10.40.160.10	TCP	54	28081 → 2082 [ACK] Seq=32497 Ack=73339 Win=4099 Len=0
279	1.728845	10.40.160.14	10.40.160.10	TCP	78	28081 → 2082 [PSH, ACK] Seq=32497 Ack=73339 Win=4099 Len=24
280	1.728859	10.40.160.10	10.40.160.14	TCP	1514	2082 → 28081 [ACK] Seq=73339 Ack=32473 Win=8209 Len=1460
281	1.728885	10.40.160.14	10.40.160.10	TCP	54	28081 → 2082 [ACK] Seq=32521 Ack=74799 Win=4100 Len=0
282	1.729128	10.40.160.10	10.40.160.14	TCP	1514	2082 → 28081 [ACK] Seq=74799 Ack=32473 Win=8209 Len=1460
283	1.729128	10.40.160.10	10.40.160.14	TCP	1514	2082 → 28081 [ACK] Seq=76259 Ack=32473 Win=8209 Len=1460
284	1.729128	10.40.160.10	10.40.160.14	TCP	325	2082 → 28081 [PSH, ACK] Seq=77719 Ack=32473 Win=8209 Len=271
285	1.729159	10.40.160.14	10.40.160.10	TCP	54	28081 → 2082 [ACK] Seq=32521 Ack=77990 Win=4100 Len=0
286	1.729229	10.40.160.14	10.40.160.10	TCP	78	28081 → 2082 [PSH, ACK] Seq=32521 Ack=77990 Win=4100 Len=24
287	1.729319	10.40.160.10	10.40.160.14	TCP	1514	2082 → 28081 [ACK] Seq=77990 Ack=32497 Win=8209 Len=1460
288	1.729341	10.40.160.14	10.40.160.10	TCP	54	28081 → 2082 [ACK] Seq=32545 Ack=79450 Win=4100 Len=0
289	1.729368	10.40.160.10	10.40.160.14	TCP	1514	2082 → 28081 [ACK] Seq=79450 Ack=32497 Win=8209 Len=1460
290	1.729381	10.40.160.14	10.40.160.10	TCP	54	28081 → 2082 [ACK] Seq=32545 Ack=80910 Win=4100 Len=0
291	1.729559	10.40.160.10	10.40.160.14	TCP	1514	2082 → 28081 [ACK] Seq=80910 Ack=32497 Win=8209 Len=1460
292	1.729559	10.40.160.10	10.40.160.14	TCP	325	2082 → 28081 [PSH, ACK] Seq=82370 Ack=32497 Win=8209 Len=271
293	1.729576	10.40.160.14	10.40.160.10	TCP	54	28081 → 2082 [ACK] Seq=32545 Ack=82641 Win=4100 Len=0
294	1.729626	10.40.160.14	10.40.160.10	TCP	78	28081 → 2082 [PSH, ACK] Seq=32545 Ack=82641 Win=4100 Len=24
295	1.729757	10.40.160.10	10.40.160.14	TCP	1514	2082 → 28081 [ACK] Seq=82641 Ack=32521 Win=8208 Len=1460
296	1.729774	10.40.160.14	10.40.160.10	TCP	54	28081 → 2082 [ACK] Seq=32569 Ack=84101 Win=4100 Len=0
297	1.729834	10.40.160.10	10.40.160.14	TCP	1514	2082 → 28081 [ACK] Seq=84101 Ack=32521 Win=8208 Len=1460
298	1.729848	10.40.160.14	10.40.160.10	TCP	54	28081 → 2082 [ACK] Seq=32569 Ack=85561 Win=4100 Len=0
299	1.730036	10.40.160.10	10.40.160.14	TCP	1514	2082 → 28081 [ACK] Seq=85561 Ack=32521 Win=8208 Len=1460
300	1.730036	10.40.160.10	10.40.160.14	TCP	325	2082 → 28081 [PSH, ACK] Seq=87021 Ack=32521 Win=8208 Len=271
301	1.730059	10.40.160.14	10.40.160.10	TCP	54	28081 → 2082 [ACK] Seq=32569 Ack=87292 Win=4100 Len=0
302	1.730081	10.40.160.10	10.40.160.14	TCP	1514	2082 → 28081 [ACK] Seq=87292 Ack=32545 Win=8208 Len=1460
303	1.730095	10.40.160.14	10.40.160.10	TCP	54	28081 → 2082 [ACK] Seq=32569 Ack=88752 Win=4100 Len=0
304	1.730118	10.40.160.14	10.40.160.10	TCP	78	28081 → 2082 [PSH, ACK] Seq=32569 Ack=88752 Win=4100 Len=24
305	1.730185	10.40.160.10	10.40.160.14	TCP	1514	2082 → 28081 [ACK] Seq=88752 Ack=32545 Win=8208 Len=1460
306	1.730199	10.40.160.14	10.40.160.10	TCP	54	28081 → 2082 [ACK] Seq=32593 Ack=90212 Win=4100 Len=0
307	1.730369	10.40.160.10	10.40.160.14	TCP	1514	2082 → 28081 [ACK] Seq=90212 Ack=32545 Win=8208 Len=1460
308	1.730369	10.40.160.10	10.40.160.14	TCP	325	2082 → 28081 [PSH, ACK] Seq=91672 Ack=32545 Win=8208 Len=271
309	1.730387	10.40.160.14	10.40.160.10	TCP	54	28081 → 2082 [ACK] Seq=32593 Ack=91943 Win=4100 Len=0
310	1.730449	10.40.160.14	10.40.160.10	TCP	78	28081 → 2082 [PSH, ACK] Seq=32593 Ack=91943 Win=4100 Len=24
311	1.730467	10.40.160.10	10.40.160.14	TCP	1514	2082 → 28081 [ACK] Seq=91943 Ack=32545 Win=8208 Len=1460
312	1.730482	10.40.160.14	10.40.160.10	TCP	54	28081 → 2082 [ACK] Seq=32617 Ack=93403 Win=4100 Len=0
313	1.730752	10.40.160.10	10.40.160.14	TCP	1514	2082 → 28081 [ACK] Seq=93403 Ack=32545 Win=8208 Len=1460
314	1.730752	10.40.160.10	10.40.160.14	TCP	1514	2082 → 28081 [ACK] Seq=94863 Ack=32545 Win=8208 Len=1460
315	1.730752	10.40.160.10	10.40.160.14	TCP	325	2082 → 28081 [PSH, ACK] Seq=96323 Ack=32545 Win=8208 Len=271
316	1.730771	10.40.160.14	10.40.160.10	TCP	54	28081 → 2082 [ACK] Seq=32617 Ack=96594 Win=4100 Len=0
317	1.730816	10.40.160.14	10.40.160.10	TCP	78	28081 → 2082 [PSH, ACK] Seq=32617 Ack=96594 Win=4100 Len=24
318	1.730937	10.40.160.10	10.40.160.14	TCP	1514	2082 → 28081 [ACK] Seq=96594 Ack=32545 Win=8208 Len=1460
319	1.730937	10.40.160.10	10.40.160.14	TCP	437	2082 → 28081 [PSH, ACK] Seq=98054 Ack=32545 Win=8208 Len=383
320	1.730937	10.40.160.10	10.40.160.14	TCP	60	2082 → 28081 [ACK] Seq=98437 Ack=32593 Win=8208 Len=0
321	1.730957	10.40.160.14	10.40.160.10	TCP	54	28081 → 2082 [ACK] Seq=32641 Ack=98437 Win=4100 Len=0
322	1.730994	10.40.160.14	10.40.160.10	TCP	78	28081 → 2082 [PSH, ACK] Seq=32641 Ack=98437 Win=4100 Len=24
323	1.731274	10.40.160.10	10.40.160.14	TCP	60	2082 → 28081 [ACK] Seq=98437 Ack=32641 Win=8208 Len=0
324	1.741485	10.40.160.10	10.40.160.14	TCP	60	2082 → 28081 [ACK] Seq=98437 Ack=32665 Win=8208 Len=0
325	1.758810	AbbAbbSaceDi_10:9e:a4	Broadcast	ARP	60	ARP Announcement for 10.40.160.102
326	1.800751	AbbAbbSaceDi_10:9e:a6	Broadcast	ARP	60	ARP Announcement for 10.40.160.103
327	1.904719	Dell_98:32:ee	Broadcast	ARP	60	Who has 10.40.160.1? Tell 10.40.160.17
328	2.094480	10.40.160.10	10.40.160.14	TCP	60	[TCP Keep-Alive] 2085 → 28084 [ACK] Seq=1 Ack=1 Win=8210 Len=1
329	2.094516	10.40.160.14	10.40.160.10	TCP	66	[TCP Keep-Alive ACK] 28084 → 2085 [ACK] Seq=1 Ack=2 Win=507 Len=0 SLE=1 SRE=2
330	2.120513	10.40.160.10	10.40.160.14	TCP	107	2082 → 28081 [PSH, ACK] Seq=98437 Ack=32665 Win=8208 Len=53
331	2.120675	10.40.160.14	10.40.160.10	TCP	78	28081 → 2082 [PSH, ACK] Seq=32665 Ack=98490 Win=4100 Len=24
332	2.131432	10.40.160.10	10.40.160.14	TCP	60	2082 → 28081 [ACK] Seq=98490 Ack=32689 Win=8208 Len=0
333	2.135535	Dell_16:33:d3	Broadcast	ARP	60	Who has 10.40.160.1? Tell 10.40.160.15
334	2.140358	10.40.160.14	10.40.160.10	TCP	55	[TCP Keep-Alive] 28084 → 2085 [ACK] Seq=0 Ack=2 Win=507 Len=1
335	2.140975	10.40.160.10	10.40.160.14	TCP	66	[TCP Keep-Alive ACK] 2085 → 28084 [ACK] Seq=2 Ack=1 Win=8210 Len=0 SLE=0 SRE=1
336	2.157405	10.40.160.10	10.40.160.14	TCP	60	[TCP Keep-Alive] 2080 → 28083 [ACK] Seq=2549 Ack=49 Win=8209 Len=1
337	2.157433	10.40.160.14	10.40.160.10	TCP	66	[TCP Keep-Alive ACK] 28083 → 2080 [ACK] Seq=49 Ack=2550 Win=4096 Len=0 SLE=2549 SRE=2550
338	2.171896	10.40.160.14	10.40.160.10	TCP	55	[TCP Keep-Alive] 28083 → 2080 [ACK] Seq=48 Ack=2550 Win=4096 Len=1
339	2.172647	10.40.160.10	10.40.160.14	TCP	66	[TCP Keep-Alive ACK] 2080 → 28083 [ACK] Seq=2550 Ack=49 Win=8209 Len=0 SLE=48 SRE=49
340	2.219037	10.40.160.10	10.40.160.14	TCP	60	[TCP Keep-Alive] 2084 → 28082 [ACK] Seq=1 Ack=1 Win=8211 Len=1
341	2.219078	10.40.160.14	10.40.160.10	TCP	66	[TCP Keep-Alive ACK] 28082 → 2084 [ACK] Seq=1 Ack=2 Win=508 Len=0 SLE=1 SRE=2
342	2.264488	10.40.160.14	10.40.160.10	TCP	55	[TCP Keep-Alive] 28082 → 2084 [ACK] Seq=0 Ack=2 Win=508 Len=1
343	2.265138	10.40.160.10	10.40.160.14	TCP	66	[TCP Keep-Alive ACK] 2084 → 28082 [ACK] Seq=2 Ack=1 Win=8211 Len=0 SLE=0 SRE=1
344	2.274505	Dell_99:4f:87	Broadcast	ARP	60	Who has 10.40.160.1? Tell 10.40.160.18
345	2.290407	10.40.160.14	10.40.160.10	TCP	154	28081 → 2082 [PSH, ACK] Seq=32689 Ack=98490 Win=4100 Len=100
346	2.292583	10.40.160.14	10.40.160.10	TCP	1498	28081 → 2082 [PSH, ACK] Seq=32789 Ack=98490 Win=4100 Len=1444
347	2.292741	10.40.160.14	10.40.160.10	TCP	1498	28081 → 2082 [PSH, ACK] Seq=34233 Ack=98490 Win=4100 Len=1444
348	2.292818	10.40.160.14	10.40.160.10	TCP	1498	28081 → 2082 [PSH, ACK] Seq=35677 Ack=98490 Win=4100 Len=1444
349	2.292914	10.40.160.14	10.40.160.10	TCP	1498	28081 → 2082 [PSH, ACK] Seq=37121 Ack=98490 Win=4100 Len=1444
350	2.292961	10.40.160.14	10.40.160.10	TCP	1498	28081 → 2082 [PSH, ACK] Seq=38565 Ack=98490 Win=4100 Len=1444
351	2.293031	10.40.160.14	10.40.160.10	TCP	1498	28081 → 2082 [PSH, ACK] Seq=40009 Ack=98490 Win=4100 Len=1444
352	2.293099	10.40.160.14	10.40.160.10	TCP	1498	28081 → 2082 [PSH, ACK] Seq=41453 Ack=98490 Win=4100 Len=1444
353	2.293168	10.40.160.14	10.40.160.10	TCP	1498	28081 → 2082 [PSH, ACK] Seq=42897 Ack=98490 Win=4100 Len=1444
354	2.293215	10.40.160.14	10.40.160.10	TCP	1246	28081 → 2082 [PSH, ACK] Seq=44341 Ack=98490 Win=4100 Len=1192
355	2.293310	10.40.160.10	10.40.160.14	TCP	78	2082 → 28081 [PSH, ACK] Seq=98490 Ack=32789 Win=8207 Len=24
356	2.293496	10.40.160.10	10.40.160.14	TCP	60	2082 → 28081 [ACK] Seq=98514 Ack=34233 Win=8212 Len=0
357	2.293496	10.40.160.10	10.40.160.14	TCP	60	2082 → 28081 [ACK] Seq=98514 Ack=35677 Win=8206 Len=0
358	2.293702	10.40.160.10	10.40.160.14	TCP	60	2082 → 28081 [ACK] Seq=98514 Ack=37121 Win=8212 Len=0
359	2.293702	10.40.160.10	10.40.160.14	TCP	60	2082 → 28081 [ACK] Seq=98514 Ack=38565 Win=8206 Len=0
360	2.293849	10.40.160.10	10.40.160.14	TCP	60	2082 → 28081 [ACK] Seq=98514 Ack=40009 Win=8212 Len=0
361	2.294141	10.40.160.10	10.40.160.14	TCP	60	2082 → 28081 [ACK] Seq=98514 Ack=41453 Win=8206 Len=0
362	2.294141	10.40.160.10	10.40.160.14	TCP	60	2082 → 28081 [ACK] Seq=98514 Ack=42897 Win=8212 Len=0
363	2.294393	10.40.160.10	10.40.160.14	TCP	60	2082 → 28081 [ACK] Seq=98514 Ack=44341 Win=8206 Len=0
364	2.294393	10.40.160.10	10.40.160.14	TCP	60	2082 → 28081 [ACK] Seq=98514 Ack=45533 Win=8212 Len=0
365	2.294393	10.40.160.10	10.40.160.14	TCP	78	2082 → 28081 [PSH, ACK] Seq=98514 Ack=45533 Win=8212 Len=24
366	2.294415	10.40.160.14	10.40.160.10	TCP	54	28081 → 2082 [ACK] Seq=45533 Ack=98538 Win=4100 Len=0
367	2.295746	10.40.160.10	10.40.160.14	TCP	78	2082 → 28081 [PSH, ACK] Seq=98538 Ack=45533 Win=8212 Len=24
368	2.296885	10.40.160.10	10.40.160.14	TCP	78	2082 → 28081 [PSH, ACK] Seq=98562 Ack=45533 Win=8212 Len=24
369	2.296913	10.40.160.14	10.40.160.10	TCP	54	28081 → 2082 [ACK] Seq=45533 Ack=98586 Win=4099 Len=0
370	2.298345	10.40.160.10	10.40.160.14	TCP	104	2082 → 28081 [PSH, ACK] Seq=98586 Ack=45533 Win=8212 Len=50
371	2.298417	10.40.160.14	10.40.160.10	TCP	78	28081 → 2082 [PSH, ACK] Seq=45533 Ack=98636 Win=4099 Len=24
372	2.299594	10.40.160.10	10.40.160.14	TCP	648	2082 → 28081 [PSH, ACK] Seq=98636 Ack=45557 Win=8212 Len=594
373	2.299672	10.40.160.14	10.40.160.10	TCP	78	28081 → 2082 [PSH, ACK] Seq=45557 Ack=99230 Win=4097 Len=24
374	2.300750	10.40.160.10	10.40.160.14	TCP	1498	2082 → 28081 [PSH, ACK] Seq=99230 Ack=45581 Win=8212 Len=1444
375	2.300893	10.40.160.14	10.40.160.10	TCP	78	28081 → 2082 [PSH, ACK] Seq=45581 Ack=100674 Win=4100 Len=24
376	2.301791	10.40.160.10	10.40.160.14	TCP	1498	2082 → 28081 [PSH, ACK] Seq=100674 Ack=45605 Win=8212 Len=1444
377	2.301873	10.40.160.14	10.40.160.10	TCP	78	28081 → 2082 [PSH, ACK] Seq=45605 Ack=102118 Win=4094 Len=24
378	2.302715	10.40.160.10	10.40.160.14	TCP	1498	2082 → 28081 [PSH, ACK] Seq=102118 Ack=45629 Win=8212 Len=1444
379	2.302715	10.40.160.10	10.40.160.14	TCP	308	2082 → 28081 [PSH, ACK] Seq=103562 Ack=45629 Win=8212 Len=254
380	2.302738	10.40.160.14	10.40.160.10	TCP	54	28081 → 2082 [ACK] Seq=45629 Ack=103816 Win=4100 Len=0
381	2.302818	10.40.160.14	10.40.160.10	TCP	78	28081 → 2082 [PSH, ACK] Seq=45629 Ack=103816 Win=4100 Len=24
382	2.313913	10.40.160.10	10.40.160.14	TCP	60	2082 → 28081 [ACK] Seq=103816 Ack=45653 Win=8212 Len=0
383	2.437486	10.40.160.14	10.40.160.174	TLSv1.2	996	Application Data
384	2.444874	10.40.160.174	10.40.160.14	TLSv1.2	558	Application Data
385	2.444874	10.40.160.174	10.40.160.14	TLSv1.2	248	Application Data
386	2.444937	10.40.160.14	10.40.160.174	TCP	54	47825 → 443 [ACK] Seq=2881 Ack=2640 Win=510 Len=0
387	2.448352	10.40.160.14	10.40.160.174	TLSv1.2	959	Application Data
